{
  "$schema": "https://json-schema.org/draft/2020-12/schema",
  "$id": "gamecult.eve.runtime_split_handoff.v1",
  "title": "Eve Runtime Split Handoff",
  "type": "object",
  "required": [
    "schema",
    "splitTarget",
    "ownerRepo",
    "currentHostRepo",
    "runtimeId",
    "sourcePackageRoot",
    "destinationPackageRoot",
    "authorityBoundary",
    "moveSets",
    "contractInputs",
    "forbiddenImports",
    "requiredExternalProofs"
  ],
  "properties": {
    "schema": {
      "const": "gamecult.eve.runtime_split_handoff.v1"
    },
    "splitTarget": {
      "type": "string",
      "minLength": 1
    },
    "ownerRepo": {
      "type": "string",
      "minLength": 1
    },
    "currentHostRepo": {
      "type": "string",
      "minLength": 1
    },
    "runtimeId": {
      "type": "string",
      "minLength": 1
    },
    "packageName": {
      "type": "string"
    },
    "sourcePackageRoot": {
      "type": "string",
      "minLength": 1
    },
    "destinationPackageRoot": {
      "type": "string",
      "minLength": 1
    },
    "authorityBoundary": {
      "type": "string",
      "minLength": 1
    },
    "moveSets": {
      "type": "array",
      "minItems": 1,
      "items": {
        "type": "object",
        "required": [
          "id",
          "stage",
          "destinationOwner",
          "replacementProof"
        ],
        "properties": {
          "id": {
            "type": "string",
            "minLength": 1
          },
          "stage": {
            "type": "string",
            "minLength": 1
          },
          "currentPaths": {
            "type": "array",
            "items": {
              "type": "string",
              "minLength": 1
            }
          },
          "observedProviderPaths": {
            "type": "array",
            "items": {
              "type": "string",
              "minLength": 1
            }
          },
          "replacementRequired": {
            "type": "array",
            "items": {
              "type": "string",
              "minLength": 1
            }
          },
          "destinationOwner": {
            "type": "string",
            "minLength": 1
          },
          "replacementProof": {
            "type": "string",
            "minLength": 1
          }
        },
        "additionalProperties": true
      }
    },
    "contractInputs": {
      "type": "array",
      "minItems": 1,
      "items": {
        "type": "string",
        "minLength": 1
      }
    },
    "forbiddenImports": {
      "type": "array",
      "items": {
        "type": "string",
        "minLength": 1
      }
    },
    "requiredExternalProofs": {
      "type": "array",
      "minItems": 1,
      "items": {
        "type": "string",
        "minLength": 1
      }
    }
  },
  "additionalProperties": true
}
