{
  "schema": "gamecult.eve.runtime_split_handoff.v1",
  "splitTarget": "EveUnity",
  "ownerRepo": "EveUnity",
  "currentHostRepo": "Eve",
  "runtimeId": "unity-scene",
  "packageName": "org.gamecult.eve.unity-scene",
  "sourcePackageRoot": "runtimes/incubating/eve-unity-scene",
  "destinationPackageRoot": "packages/org.gamecult.eve.unity-scene",
  "authorityBoundary": "EveUnity owns generic Unity scene projection for provider-authored world surfaces: scene graph construction, camera/input binding, Unity package lifecycle, scene capture, and command intent emission through advertised provider command boundaries. Providers such as Aetheria own world state, assets, simulation, command authorization, receipts, and authored scenario flows. Eve keeps only the surface, command, provider advertisement, runtime capability, and conformance export contracts.",
  "moveSets": [
    {
      "id": "unity-scene-runtime-body",
      "stage": "runtime-body",
      "currentPaths": [
        "runtimes/incubating/eve-unity-scene/package.json",
        "runtimes/incubating/eve-unity-scene/Runtime/GameCult.Eve.UnityScene.asmdef",
        "runtimes/incubating/eve-unity-scene/Runtime/EveUnitySceneSurfaceLowerer.cs",
        "runtimes/incubating/eve-unity-scene/Runtime/SaiVisualNovelUnitySceneProjectionAdapter.cs",
        "runtimes/incubating/eve-unity-scene/Runtime/NornGraphUnitySceneProjectionAdapter.cs",
        "runtimes/incubating/eve-unity-scene/Runtime/TeXMathUnitySceneProjectionAdapter.cs",
        "runtimes/incubating/eve-unity-scene/Tests/Editor/GameCult.Eve.UnityScene.Tests.asmdef",
        "runtimes/incubating/eve-unity-scene/Tests/Editor/EveUnitySceneSurfaceLowererTests.cs"
      ],
      "destinationOwner": "EveUnity",
      "replacementProof": "EveUnity hosts a provider-agnostic Unity scene lowerer that consumes provider advertisements and world surfaces without importing Aetheria runtime internals."
    },
    {
      "id": "unity-scene-world-surface-lowering",
      "stage": "world-surface-lowering",
      "currentPaths": [
        "runtimes/incubating/eve-unity-scene/Runtime/EveUnitySceneSurfaceLowerer.cs",
        "runtimes/incubating/eve-unity-scene/Runtime/SaiVisualNovelUnitySceneProjectionAdapter.cs",
        "runtimes/incubating/eve-unity-scene/Runtime/NornGraphUnitySceneProjectionAdapter.cs",
        "runtimes/incubating/eve-unity-scene/Runtime/TeXMathUnitySceneProjectionAdapter.cs",
        "runtimes/incubating/eve-unity-scene/Tests/Editor/EveUnitySceneSurfaceLowererTests.cs",
        "runtimes/incubating/eve-unity-scene/eve-runtime-capability.json"
      ],
      "destinationOwner": "EveUnity",
      "replacementProof": "EveUnity claims the provider-advertised unity-scene lowering target with provider-agnostic scene graph projection and command boundary evidence; capture remains a separate lifecycle proof."
    },
    {
      "id": "unity-scene-sai-plugin-projection",
      "stage": "plugin-projection",
      "currentPaths": [
        "runtimes/incubating/eve-unity-scene/Runtime/SaiVisualNovelUnitySceneProjectionAdapter.cs",
        "runtimes/incubating/eve-unity-scene/Runtime/EveUnitySceneSurfaceLowerer.cs",
        "runtimes/incubating/eve-unity-scene/Tests/Editor/EveUnitySceneSurfaceLowererTests.cs",
        "runtimes/incubating/eve-unity-scene/eve-runtime-capability.json"
      ],
      "destinationOwner": "EveUnity",
      "replacementProof": "EveUnity owns only the Unity scene projection adapter for Sai's sidecar-advertised VN capabilities; Sai keeps story state, VN/Ink semantics, and story command interpretation."
    },
    {
      "id": "unity-scene-norn-plugin-projection",
      "stage": "plugin-projection",
      "currentPaths": [
        "runtimes/incubating/eve-unity-scene/Runtime/NornGraphUnitySceneProjectionAdapter.cs",
        "runtimes/incubating/eve-unity-scene/Runtime/EveUnitySceneSurfaceLowerer.cs",
        "runtimes/incubating/eve-unity-scene/Tests/Editor/EveUnitySceneSurfaceLowererTests.cs",
        "runtimes/incubating/eve-unity-scene/eve-runtime-capability.json"
      ],
      "destinationOwner": "EveUnity",
      "replacementProof": "EveUnity owns only the Unity scene projection adapter for Norn's sidecar-advertised embed.norn capability; Norn keeps graph layout, graph state, and graph command semantics."
    },
    {
      "id": "unity-scene-tex-plugin-projection",
      "stage": "plugin-projection",
      "currentPaths": [
        "runtimes/incubating/eve-unity-scene/Runtime/TeXMathUnitySceneProjectionAdapter.cs",
        "runtimes/incubating/eve-unity-scene/Runtime/EveUnitySceneSurfaceLowerer.cs",
        "runtimes/incubating/eve-unity-scene/Tests/Editor/EveUnitySceneSurfaceLowererTests.cs",
        "runtimes/incubating/eve-unity-scene/eve-runtime-capability.json"
      ],
      "destinationOwner": "EveUnity",
      "replacementProof": "EveUnity owns only the Unity scene projection shell for TeX's sidecar-advertised embed.tex capability; EvePlugins keeps TeX parsing, typesetting, baseline metrics, and render-cache semantics."
    },
    {
      "id": "unity-scene-command-transport",
      "stage": "command",
      "currentPaths": [
        "runtimes/incubating/eve-unity-scene/Runtime/EveUnitySceneSurfaceLowerer.cs",
        "runtimes/incubating/eve-unity-scene/Tests/Editor/EveUnitySceneSurfaceLowererTests.cs",
        "runtimes/incubating/eve-unity-scene/eve-runtime-capability.json"
      ],
      "destinationOwner": "EveUnity",
      "replacementProof": "Unity scene input emits gamecult.eve.command.v1 intents through provider-advertised command boundaries and renders provider receipts instead of mutating local world truth."
    },
    {
      "id": "unity-scene-capture-lifecycle",
      "stage": "capture",
      "currentPaths": [
        "tools/eveunity/eveunity-capture-contract.mjs",
        "tools/eveunity/eveunity-capture-contract.test.mjs",
        "tools/eveunity/eveunity-scene-capture-artifact.mjs",
        "tools/eveunity/eveunity-scene-capture-artifact.test.mjs",
        "scripts/run-eveunity-scene-capture-contract-smoke.ps1",
        "scripts/run-eveunity-scene-capture-smoke.ps1"
      ],
      "destinationOwner": "EveUnity",
      "replacementProof": "EveUnity builds a provider-advertisement-backed Unity scene capture request and deterministic gamecult.eve.unity_scene_projection.v1 JSON projection artifact now; the split is not complete until EveUnity attaches Unity scene screenshot or frame-capture PNG artifacts to conformance output for at least one provider-authored world surface."
    }
  ],
  "contractInputs": [
    "gamecult.eve.surface.v1",
    "gamecult.eve.command.v1",
    "gamecult.eve.provider_advertisement.v1",
    "gamecult.eve.runtime_capability.v1",
    "gamecult.eve.conformance_export.v1"
  ],
  "forbiddenImports": [
    "Aetheria daemon state as Unity scene runtime authority",
    "Aetheria gameplay scripts as EveUnity scene lowerer truth",
    "provider-specific scene components that bypass gamecult.eve.command.v1",
    "renderer-local world simulation as provider truth",
    "product assets bundled as Eve runtime contract",
    "Sai story state, VN/Ink semantics, or story command interpretation as Unity scene runtime authority",
    "Norn graph layout, graph state, or command semantics as Unity scene runtime authority",
    "TeX parsing, typesetting, baseline metrics, or render-cache semantics as Unity scene runtime authority"
  ],
  "requiredExternalProofs": [
    "EveUnity publishes a Unity scene runtime capability manifest.",
    "EveUnity owns a provider-agnostic scene graph lowerer that consumes advertised worldInteraction boundaries without importing Aetheria internals.",
    "EveUnity owns the provider-agnostic scene graph lowerer outside Eve incubation.",
    "EveUnity owns the Unity scene Sai projection adapter outside Eve incubation without importing Sai story state or VN/Ink internals.",
    "EveUnity owns the Unity scene Norn projection adapter outside Eve incubation without importing Norn implementation state.",
    "EveUnity owns the Unity scene TeX projection adapter outside Eve incubation without importing TeX implementation state.",
    "EveUnity lowers at least one non-Aetheria provider-authored world surface into Unity scene objects.",
    "EveUnity lowers Aetheria's game world surface through provider advertisements without importing Aetheria internals.",
    "Unity scene input emits gamecult.eve.command.v1 intents and renders provider receipts.",
    "Unity scene screenshot or frame-capture PNG artifacts are attached to conformance output."
  ]
}
